index,image,annotator,description
2384,cuhk03/image=06_set=2_id=0182.png,B12,"A tall man with short black hair seems about to board a ship, as he's walking up a ramp. He is wearing black shoes and trousers, and a hooded top with long sleeves and a white and grey checkered pattern. He has a black and grey bag hanging from his right shoulder, while steadying it with his right hand, and something that looks like a piece of black clothing slung over his left arm."
2385,cuhk03/image=06_set=2_id=0183.png,B12,"A skinny young man with his black hair hanging over his ears is walking away from the camera with a black backpack hanging from both shoulders. He is wearing a light grey hooded top with long sleeves and long, tight-fitting beige or white trousers with white and dark brown or red sneakers."
2386,cuhk03/image=06_set=2_id=0184.png,B12,"A young woman walking with a red over-sized bag on her right shoulder, wearing her long black hair loose. Her jacket is black and long sleeved with tight fitting black trousers, and black shoes showing white rims around the soles. She is holding something in her left hand that could possibly be a pamphlet, and looks like she's reaching toward something in front of her with her right."
2387,cuhk03/image=06_set=2_id=0185.png,B12,"A woman with medium length dark brown hair is walking away from the camera. She is wearing a three quarter sleeve jacket which is flapping open at the front and a flowing skirt in a light grey or blue pattern of very light material, black stockings and black and white platform shoes. She has a wristwatch on her let arm and a large brown or black bag over her right shoulder."
2388,cuhk03/image=06_set=2_id=0186.png,B12,"Picture of a young girl with long, dark brown hair looking at the phone in her left hand as she approaches. She is wearing a white t-shirt showing a red print on the chest and baggy light grey trousers with white and black running shoes."
2418,cuhk03/image=06_set=2_id=0216.png,B13,"A tall and pretty girl, with long and dark hair, appears to be walking while holding a guy's hand. She wears a black coloured tee with white designs on it with a pair of black or grey coloured leggings. She wears a black jacket and a pair of red high heeled shoes. She appears to be smiling."
1358,cuhk03/image=01_set=3_id=0076.png,A13,"A medium height and medium built young man with short black hair. He wears a large white t-shirt with black collar and cuff lines and light blue jeans along with black shoes. He might be carrying a large bag on his right and seems to be holding a white object, probably a tablet or a mobile phone with both hands."
1357,cuhk03/image=01_set=3_id=0075.png,A13,"A young woman with long, straight, black hair and pale skin. She wears a long grey top with a maroon cardigan on top, light grey skinny fit pants and brown flat shoes. She carries a black back pack and wears a black bracelet or watch on her left wrist."
1356,cuhk03/image=01_set=3_id=0074.png,A13,A medium built and medium height man with pale skin and dark colored hair. He wears a maroon colored t-shirt with dark grey pants and black shoes and he wears a black watch on his left wrist. He might be wearing glasses.
1355,cuhk03/image=01_set=3_id=0073.png,A13,"A very short young man with his back turned against the camera. He wears a white short sleeved shirt or t-shirt, light beige knee high shorts and white shoes. He carries a black bag in his right arm. He has straight, black and short hair."
1354,cuhk03/image=01_set=3_id=0072.png,A13,The left profile of a short and medium built young man with a light blue classic shirt with its sleeves rolled up along with white shorts and dark brown colored sandals. The young man carries a black bag on his left side.
1353,cuhk03/image=01_set=3_id=0071.png,A13,"A young man with pale skin and short dark hair. He wears dark colored glasses, a red t-shirt with white print on the chest area and beige pants. He carries a black and white back pack and a watch on his left wrist."
1352,cuhk03/image=01_set=3_id=0070.png,A13,"A medium height and slim young woman with straight, black and medium length hair gathered into a ponytail. She wears a black t-shirt, black pants and white sneakers. She carries a large, light blue back pack and pushes a red bicycle with both hands. She has her right side facing the camera."
1351,cuhk03/image=01_set=3_id=0069.png,A13,"A slim and medium height young man with short black hair. He wears a light pink and long sleeved shirt, black pants and black and white nike shoes. He carries a black long strapped bag on his left arm and wears black framed glasses and a watch on his right arm. He carries a small white and dark green colored shopping bag in his left hand."
1350,cuhk03/image=01_set=3_id=0067.png,A13,"A thin and short young woman with straight, short black hair gathered into a ponytail. She wears a bright orange polo-neck t-shirt with super mini light blue jeans and black and white sport shoes. The young woman has her right side facing the camera."
1349,cuhk03/image=01_set=3_id=0066.png,A13,The right profile of a short and slim girl with dark and shoulder length hair with a fringe hair cut. She wears a black and white t-shirt with light blue jeans and white sport shoes. She carries a black shoulder bag on her right side and holds a mobile phone in her right hand.
1348,cuhk03/image=01_set=3_id=0065.png,A13,"The left profile of an Asian teenage boy with short and straight black hair. He wears black framed glasses, a black polo-neck t-shirt, blue jeans and blue and white sport shoes. The teenager holds a black mobile phone in his right hand."
1347,cuhk03/image=01_set=3_id=0064.png,A13,A medium height and medium built middle aged man wearing a white polo-neck shirt with black collars along with light grey baggy pants and black shoes. He holds a small black object in his left hand.
1346,cuhk03/image=01_set=3_id=0063.png,A13,"A young woman with dark colored, straight long hair gathered into a low ponytail. She wears a light beige and white horizontal striped t-shirt with white pants and light blue sport shoes. She carries a white beach bag on her left and holds a mobile phone in her left hand. She has her back turned against the camera."
1345,cuhk03/image=01_set=3_id=0062.png,A13,"A young man with short black hair. He wears a white polo-neck t-shirt, black sweat pants with white stripes on each side, grey and white sport shoes. He carries a black bag on his right shoulder and has his left side facing the camera."
1344,cuhk03/image=01_set=3_id=0061.png,A13,"A middle aged and medium built, short man with short black and grey hair. He wears a long sleeved white polo neck top with green collars and rolled up sleeves along with light grey fabric pants and dark colored shoes."
1343,cuhk03/image=01_set=3_id=0060.png,A13,"A skinny and athletic young man with pale skin, slightly long, wavy, brown hair and a beard. He wears a dark grey t-shirt with white print on the front, black and grey knee high tight shorts, black socks, grey and white sport shoes."
1342,cuhk03/image=01_set=3_id=0059.png,A13,"A medium built and short middle aged woman with short black hair. She wears a grey t-shirt with black and white print on the front, ice blue jeans , bright blue and white sport shoes. She wears a large beach bag on her right shoulder and seems to be wearing a silver colored bracelet on her left wrist."
1341,cuhk03/image=01_set=3_id=0058.png,A13,"The right profile of a teenage boy with short black hair, pale skin and black framed glasses. He wears a bright red t-shirt, light grey pants and black shoes. He wears a black long strapped bag cross body."
1340,cuhk03/image=01_set=3_id=0057.png,A13,"A medium built and medium height young man with slightly long, straight black hair, wearing a grey t-shirt with a British flag on the front, dark blue jeans and black and white sport shoes. He wears a black watch on his left wrist and he carries a dark colored jacket with his right hand."
1339,cuhk03/image=01_set=3_id=0056.png,A13,"A medium built young man with short black hair. He wears black framed glasses, a black t-shirt with white print on the front, knee high light beige cargo shorts and white high neck sport shoes with dark green shoelaces. He wears a black watch on his left wrist."
1338,cuhk03/image=01_set=3_id=0055.png,A13,"The left profile of a middle aged, medium built and short man with grey and black slightly long hair. He wears a white t-shirt, light beige fabric pants and dark colored shoes. He holds a black and white bag in his left hand."
1337,cuhk03/image=01_set=3_id=0054.png,A13,"The left profile of a short and slim young woman with straight black hair. She wears a light beige cardigan, a light red knee high skirt and light colored shoes. She carries a large black bag on her right arm. The resolution of the photo is very low."
1336,cuhk03/image=01_set=3_id=0053.png,A13,"A young slim man with medium height and short black hair. He wears a light red t-shirt, light grey baggy pants and white shoes. He carries a long strapped black bag cross body and seems to be wearing black framed glasses. The young man has his back facing the camera."
1335,cuhk03/image=01_set=3_id=0052.png,A13,"A short and medium built young man with straight, black and short hair. He wears a black and white horizontal striped t-shirt, black pants and black and white sport shoes. He carries a grey and black long strapped bag crossed body and has his back turned against the camera."
1334,cuhk03/image=01_set=3_id=0051.png,A13,"A medium height and medium built young man with short black hair and sideburns. He wears a formal, long sleeved white shirt on top of light grey fabric pants and black leather classic shoes. He holds a black object, probably a notebook in his left hand. He has his back turned against the camera."
1333,cuhk03/image=01_set=3_id=0050.png,A13,"A medium built and short middle aged Asian woman with curly, dark brown and medium length hair. She wears brown framed glasses, a light grey or white short sleeved shirt with navy collars, darker grey baggy pants and black and white sport shoes. She carries a light colored pinkish bag on her right arm and wears a silver watch on her left wrist."
1332,cuhk03/image=01_set=3_id=0049.png,A13,A medium built and medium height Asian young man with black hair. He wears a dark grey polo t-shirt with black cuffs and collars along with light grey knee high sport shorts and white and red flip flops. He wears a black watch on his left wrist and his left side is turned to the camera.
1331,cuhk03/image=01_set=3_id=0048.png,A13,"A slim and long young woman with pale skin, straight and dark colored hair tied into a low ponytail. She wears a blue t-shirt, a dark grey cardigan and blue jeans along with black and white shoes. She seems to be holding an object in both hands."
1330,cuhk03/image=01_set=3_id=0047.png,A13,"The left profile of a medium built, short young man with black hair and pale skin. He wears a red short sleeved shirt or a t-shirt along with blue jeans and black and white sport shoes. He carries a large black back pack and seems to be holding something in both hands."
1329,cuhk03/image=01_set=3_id=0046.png,A13,"A medium built, short man with black hair. He wears a white t-shirt with black, yellow and orange print on the chest area, black jeans and blue and white sport shoes. He carries a yellow and black back pack."
1328,cuhk03/image=01_set=3_id=0045.png,A13,"A skinny and short young man, probably of Asian origin. He has black slightly long hair and wears black framed glasses, a light grey shirt with blue sleeves, blue jeans and black and white sport shoes. He carries a long strapped black bag which he wears cross body and holds a white mobile phone in both hands."
1327,cuhk03/image=01_set=3_id=0044.png,A13,"A middle aged, medium built woman with pale skin and short black hair with a fringe hair cut. She wears a bright pink long t-shirt and a light grey and white checked sweater on top. She also wears black knee high sport shorts and black sneakers. She carries a green and black sport bag on her right arm and some papers on her other hand."
1326,cuhk03/image=01_set=3_id=0043.png,A13,"A medium height and medium built man with black hair. He has his back turned against the camera. He wears a long sleeved, formal white shirt, light grey fabric pants and black shoes."
1325,cuhk03/image=01_set=3_id=0042.png,A13,"A skinny and medium height young man with dark colored hair. He wears a magenta colored t-shirt, dark blue jeans and black shoes. The man has his back turned against the camera."
1324,cuhk03/image=01_set=3_id=0041.png,A13,"A slim and medium height Asian man with straight black hair and a fringe hair cut. He wears a formal, long sleeved shirt, black fabric pants and black leather shoes. He carries a black bag on his right hand."
1323,cuhk03/image=01_set=3_id=0040.png,A13,"A skinny teenage boy with slightly long black hair, wearing a white t-shirt, red knee high baggy shorts, black, white and red colored sport shoes. He carries a back pack with black, purple and pink patterns on it and has his back turned against the camera."
1322,cuhk03/image=01_set=3_id=0039.png,A13,"A teenage boy with slightly long, straight and black hair. He wears a white t-shirt, brown jeans and black, white and red colored sneakers. He wears black framed glasses and a black back pack with a small yellow badge. The teenager has his back to the camera."
1321,cuhk03/image=01_set=3_id=0038.png,A13,"A young, slim and short man with slightly long, straight black hair, sideburns and a fringe hair cut. He wears a bright blue t-shirt with white print on the chest area, black sweat pants with white lines on both sides and black and white sport shoes. He carries a black back pack."
1320,cuhk03/image=01_set=3_id=0037.png,A13,"A young and slim man with short black hair. He wears a blue t-shirt, grey pants and black and white sport shoes. He carries a black back pack. He also has a red folder tucked under his left arm and has back turned against the camera."
1319,cuhk03/image=01_set=3_id=0036.png,A13,"A thin and young woman with straight, black and medium length hair. She has half of her hair gathered into a bun and the other half is free. She wears a white t-shirt under a black dress along with black stockings and black flat shoes. She carries a white bag with black straps on her left size and carries A4 sized papers under her right arm."
1318,cuhk03/image=01_set=3_id=0035.png,A13,"A young and slim young man with short black hair, wearing dark framed glasses, a light grey t-shirt, knee high tight shorts and black and neon lime sport shoes. He carries a black bag on his right shoulder and plays with his mobile phone which he holds in both hands."
1317,cuhk03/image=01_set=3_id=0034.png,A13,"A medium built and short man with slightly long straight, black hair, probably Asian. He wears a black t-shirt with white print on the front along with black jeans and black and white sport shoes. He has his right profile facing the camera."
1316,cuhk03/image=01_set=3_id=0033.png,A13,"A young and slim, medium height woman with straight, long and black hair gathered into a low ponytail. She wears a green t-shirt, a white cardigan on top and blue jeans along with black and white sport shoes. She carries a black and blue back pack and seems to be holding an object like a mobile phone in both hands."
1315,cuhk03/image=01_set=3_id=0032.png,A13,"A hunched and medium height, slim young man with slightly long black hair. He wears black framed glasses, a dark green t-shirt, light beige pants and brown shoes. He carries a black back pack and wears a black watch on his left wrist."
1314,cuhk03/image=01_set=3_id=0031.png,A13,"A thin and short young woman, probably Asian. She has dark hair and a fringe hair cut. She wears dark framed glasses, white earphones, a dark purple blouse and a white cardigan along with ice blue jeans and yellow flat shoes. She wears a black bracelet one her left wrist and carries a black bag on her right arm. The woman holds a piece of A4 sized paper in her left hand."
1313,cuhk03/image=01_set=3_id=0030.png,A13,"A slim and short young woman with her body turned against the camera. she has black hair gathered into a bun. She wears a parliament blue cardigan, blue jeans and black and white sneakers. She carries a long strapped brown bag on her right shoulder and seems to be carrying a black and white striped bag on her other hand."
1312,cuhk03/image=01_set=3_id=0029.png,A13,"A middle aged, medium built and short woman, probably of Asian origin. She has straight, dark colored and shoulder length hair. She wears a lime colored polo neck t-shirt, dark grey baggy pants and blue and white sport shoes. She is holding an object, probably a shirt in both hands."
1311,cuhk03/image=01_set=3_id=0028.png,A13,"A young woman with straight, black, long hair gathered into a low pony tail. She has a fringe hair cut and black framed glasses. She is probably of Asian origin and wears a white formal shirt under a formal black jacket along with black pants and black flat shoes. She carries a red bag on her right arm."
1310,cuhk03/image=01_set=3_id=0027.png,A13,"A teenage boy with dark complexion and short black hair. He has his back turned against the camera and the resolution is very low. He wears a white t-shirt, dark colored pants and carries a black back pack."
1309,cuhk03/image=01_set=3_id=0026.png,A13,"A medium built and medium height young man with straight black hair, a fringe hair cut and black framed glasses. He seems to be wearing a light grey t-shirt on top of light beige knee high cargo shorts, beige sandals or shoes. He has his back facing the camera and seems to be holding something in both hands, probably a mobile phone."
1308,cuhk03/image=01_set=3_id=0025.png,A13,"A medium built and medium height young man with slightly long black hair. He wears black framed glasses, a long white polo neck t-shirt and dark grey knee high cargo shorts along with black flip flops and he seems like he is holding something, probably a mobile phone in both hands."
1307,cuhk03/image=01_set=3_id=0024.png,A13,"A young, medium built and short man with slightly long straight black hair. He wears a navy shirt with yellow cuffs, light beige fabric pants and dark brown flip flops. He probably wears black glasses and has his back turned against the camera."
1306,cuhk03/image=01_set=3_id=0023.png,A13,"A young and medium built short man with a light grey t-shirt, beige cargo shorts, black socks and white sport shoes with three maroon stripes on both sides. He wears black framed glasses and has his back facing the camera."
1305,cuhk03/image=01_set=3_id=0022.png,A13,A very thin and short young man with short black hair. He wears a white or light grey polo neck t-shirt on top of blue jeans and black sport shoes. He carries a large black laptop and has his left side turned to the camera.
1304,cuhk03/image=01_set=3_id=0021.png,A13,"A slim teenage boy with slightly long straight black hair, wearing black framed glasses, a black t-shirt and white pants along with green sport shoes which have three white stripes on both sides. He carries a black shoulder bag, probably a laptop bag on his right and has his right profile turned to the camera."
1303,cuhk03/image=01_set=3_id=0020.png,A13,"A tall, medium built and broad shouldered young man with short black hair, wearing a bright red t-shirt on top of black knee high tight shorts and black sport shoes. He has his back turned against the camera and seems to be holding something in both hands probably a mobile phone or a tablet."
1302,cuhk03/image=01_set=3_id=0019.png,A13,a short and slim young man with short black hair. He wears a grey and black checked sweatshirt with a hood on top of dark blue jeans and black sport shoes. He has his back turned against the camera.
1301,cuhk03/image=01_set=3_id=0018.png,A13,"A little boy with slightly long black hair. He wears black framed glasses, a white and light grey checked sweatshirt with a hood, beige shorts and white sport shoes. The child has his back turned against the camera."
1300,cuhk03/image=01_set=3_id=0017.png,A13,"A pale skinned young and short woman with straight black hair tied into a ponytail. She wears a short sleeved white top and a maroon mini skirt with white high heeled shoes. She carries a white bag with a brown strap on her right arm, a blue folder under her left arm and a pink jacket in her left arm. She is facing the camera."
1299,cuhk03/image=01_set=3_id=0016.png,A13,"The right profile of a thin and tall looking man with short dark hair. He wears glasses, a red t-shirt with white prints in the front, black bermuda pants and beige crocks or sandals with black stripes. He holds a paper or a notebook and a pencil in his right hand."
1298,cuhk03/image=01_set=3_id=0015.png,A13,"Young and tall looking, medium size male person with short black hair. He wears a gray shirt with rolled up sleeves which is not tucked in and baggy blue jeans. He probably wears a pair of black and white snickers."
1297,cuhk03/image=01_set=3_id=0014.png,A13,The left profile of a middle-aged male with short black hair. He looks very thin and short. He wears a light blue t-shirt and black pants. He has white sport shoes. He probably carries a black cross-body bag on his back. He probably has a watch or a bracelet on his left wrist.
1296,cuhk03/image=01_set=3_id=0013.png,A13,A male person with black hair. He wears a white polo t-shirt and black sweat pants. He has a pair of white shoes possibly running shoes. He has a black backpack with a white Nike logo on it.
1295,cuhk03/image=01_set=3_id=0012.png,A13,"A slim girl with long black hair, probably wears glasses. She wears a gray t-shirt and super mini white shorts with a black button on the back. She wears light brown high heel shoes. She carries a medium size, beige and brown shoulder bag on her left shoulder. She is holding something in her right hand, possibly a cellphone."
1294,cuhk03/image=01_set=3_id=0011.png,A13,"A young man with his back turned against the camera. He looks medium built and athletic. He has dark colored hair. He wears a white t-shirt, probably with black print on the front and gray cargo pants along with black snickers with white welts. He has a large black backpack."
1293,cuhk03/image=01_set=3_id=0010.png,A13,"A young looking, slim girl with long black hair looking at her phone while walking. Her phone has a white case and its screen looks black. She wears a short and pink dress with short sleeves and black-white sport shoes. She is holding a brown bag or a jacket in her hands."
1292,cuhk03/image=01_set=3_id=0009.png,A13,"The right profile of a medium built man who seems to be middle aged. He wears glasses and has short black hair. He wears a red polo t-shirt, blue jeans and gray sneakers with white welts. He is holding a black bag in his right hand probably carrying a laptop. He is looking at his right and might be talking on his cellphone."
1291,cuhk03/image=01_set=3_id=0008.png,A13,The left profile of a young and slim male with slightly long black hair that covers top of his ears.He probably wears black sun glasses. He wears a gray t-shirt with black print on the chest area and black jeans along with purple or dark gray shoes with black welts. He holds something gold colored under his left arm.
1290,cuhk03/image=01_set=3_id=0007.png,A13,"Teenage girl who looks short and slim and has long and dark colored hair and wheat skin. She wears red framed glasses, a pink t-shirt with white prints on the chest area. She also wears small white shorts and pink flat shoes with white welts."
1289,cuhk03/image=01_set=3_id=0006.png,A13,"Athletic looking young, slim male with glasses. He wears a white t-shirt with large black print on the front. He wears white and ice blue checked shorts and colorful sneakers that have purple, green, white colors patterns on them. He wears a watch or a bracelet on his left wrist."
1288,cuhk03/image=01_set=3_id=0005.png,A13,"The right profile of a young male with glasses. He wears a dark blue t-shirt that has a white stripe on its right shoulder. He wears dark blue jean shorts and light brown leather shoes. He holds something in his left hand, probably some kind of paper."
1287,cuhk03/image=01_set=3_id=0004.png,A13,"Young and probably Asian woman who looks like she is talking on the phone via white, wired headphones. She has long black hair. She wears a navy colored short dress with short and white sleeves along with white flat shoes. She carries a pink beach bag on her left shoulder."
1286,cuhk03/image=01_set=3_id=0003.png,A13,"A young, pale skinned, medium sized male looking at something that is in his right hand, probably a cellphone. He has short black hair. He wears a black and white t-shirt that has stripes below the shoulder area. He wears gray shorts and white sneakers. He carries a big and black shoulder bag on his left shoulder."
1285,cuhk03/image=01_set=3_id=0002.png,A13,"A medium built, short and wheat skinned middle aged man with short black hair. He wears a light grey jacket and a black polo neck t-shirt under it. He also wears light green baggy pants and black sport shoes. The man has his right turned to the camera and he carries a large black beach bag on his right arm."
1284,cuhk03/image=01_set=3_id=0001.png,A13,"The profile of a very thin and short young man with slightly long black hair. He wears a white shirt a black tie, black fabric pants and black formal shoes. He is facing the camera but the photo's resolution is very low."
1283,cuhk03/image=01_set=2_id=0440.png,A13,"A black, medium built young man with his back turned against the camera. He has short black hair and wears a dark grey t-shirt, light beige or ivory colored baggy pants and white shoes and he carries a black taichi bag on the left."
