index,image,annotator,description
253,cuhk03/image=01_set=1_id=0253.png,rab,This appears to be a boy in his late teens. He has dark hair and his hair appears to be short. He wears a grey jacket with full sleeves and a pair of black pants. He wears brown colour shoes.
252,cuhk03/image=01_set=1_id=0252.png,rab,A woman with long hair. Her hair is black. She is wearing black or maroon colour top with a pair of beige or off-white pants. She wears maroon or black colour shoes. She is carrying a black colour shopping bag in her right hand.
251,cuhk03/image=01_set=1_id=0251.png,rab,Profile of a man with short dark hair. He is wearing a brown or black colour shirt with beige colour 3/4 pants. He wears spectacles. He carries a white and black colour backpack.
250,cuhk03/image=01_set=1_id=0250.png,rab,A girl with red colour tshirt which has white colour horizontal stripes on it. She has dark long hair. She is wearing dark colour pants. She is carrying a black colour backpack.
249,cuhk03/image=01_set=1_id=0249.png,rab,"An Asian with medium build, curiously looking at something above. He wears specs. He wears a white tshirt and a grey or white jacket on it. He wears a pair of grey pants and red shoes. He has short hair and his hair is black."
248,cuhk03/image=01_set=1_id=0248.png,rab,"A tall man, probably running, wearing a black jacket with a pair of grey shorts. He wears a pair of white shoes. He wears red or black colour eye glasses and his hair is dark and short. He carries a black backpack on his back."
247,cuhk03/image=01_set=1_id=0247.png,rab,"A guy wearing spectacles, with dark short hair. He is wearing black tshirt with white prints on it. He wears a pair of black pants and has tied his jacket around his waist covering his pants. He wears brown colour shoes. He carries a bag on his right shoulder."
246,cuhk03/image=01_set=1_id=0246.png,rab,"A very thin man, who is wearing a blue colour full sleeve shirt and a pair of black trousers. He appears to be in formal wear. He carries a laptop bag and a shopping bag in his left hand. He checks on his phone with his right hand. He has short dark hair."
245,cuhk03/image=01_set=1_id=0245.png,rab,A medium build person wearing beige or off-white full sleeve sweatshirt with a pair of white pants and white shoes. His hair is black and short. He carries a black backpack on his back and a white shopping bag in his left hand.
244,cuhk03/image=01_set=1_id=0244.png,rab,A boy carrying his grey or black backpack on his back. He is wearing white or green polo tshirt with a pair of dark pants and dark shoes. His tshirt has horizontal black stripes on it.
243,cuhk03/image=01_set=1_id=0243.png,rab,"A tall man with black hair, his hair is short. He is wearing grey or ash colour tshirt with black borders. His shorts are black and white in colour with horizontal stripes. He is wearing black or red slippers."
242,cuhk03/image=01_set=1_id=0242.png,rab,"A fat man with short black hair, wearing a full hand tshirt with grey stripes on it. He is carrying a backpack which is grey in colour. He is operating his mobile phone with his hands."
241,cuhk03/image=01_set=1_id=0241.png,rab,"A medium build man with dark hair. His hair is short, up to his neck. He is wearing a black shirt which has large grey stripes on it and a pair of grey pants. He is carrying a grey and green backpack."
240,cuhk03/image=01_set=1_id=0240.png,rab,"A boy in his mid teens, walking as he talks on his phone to someone. He has brown short hair. He is wearing a blue shirt and a pair of black pants. His shoes are white and his watch on his left wrist is black. He carries a bag on his right shoulder."
239,cuhk03/image=01_set=1_id=0239.png,rab,"A tall guy with dark short hair, probably an Asian. He has his left hand inside his pants' left pocket. He wears a white tshirt with a pair of grey pants and white shoes. He is carrying a black backpack."
238,cuhk03/image=01_set=1_id=0238.png,rab,"A boy, probably in his teenage. He is tall and thin and he is wearing a yellow colour tshirt with a pair of black shorts. He is carrying a laptop bag on his right shoulder. He is wearing brown colour sandals and is checking on his mobile phone with his hands."
237,cuhk03/image=01_set=1_id=0237.png,rab,A man walking with his hands inside his jacket's pockets. He is wearing a black and white jacket with checks on it. It has a hoodie on the top. He wears a pair of dark colour pants and white shoes. He has short hair and his hair is dark.
236,cuhk03/image=01_set=1_id=0236.png,rab,Image of a girl in her red colour tops with white colour polka dots on it. She wears a pair of dark colour skinny jeans. She is wearing white colour sandals. She carries a white colour shoulder bag on her right shoulder. Her hair is long and black.
235,cuhk03/image=01_set=1_id=0235.png,rab,"A man wearing spectacles and carrying a black backpack on his right shoulder. He has dark short hair. He is wearing white tshirt with a pair of dark colour jeans. He has attached something on the left side of his pants, probably an activity tracker."
234,cuhk03/image=01_set=1_id=0234.png,rab,"A tall boy who should be around 20 years old, wearing a white tee with a pair of beige or pink colour shorts. He is wearing black colour shoes. He is carrying a black colour cross body bag on his left shoulder."
233,cuhk03/image=01_set=1_id=0233.png,rab,Profile of a man with short dark hair. He appears to be wearing grey colour hoodie jacket with a pair of black colour track pants or trousers. He is carrying a shopping bag in his right arm. He is wearing white colour shoes.
232,cuhk03/image=01_set=1_id=0232.png,rab,A girl in her late teens or early twenties with long dark hair. She is wearing a beige colour top with a black colour cardigan on it. She wears a pair of black colour pants. She carries a red backpack on her back and is holding a beige colour clutch in her right hand.
231,cuhk03/image=01_set=1_id=0231.png,rab,Appears to be a picture of a tall woman with fair skin tone. She has short hair and her hair is black. She is wearing a black and white full sleeve tee with a pair of dark colour jeans. She is wearing dark colour shoes. She is carrying a bag on her right shoulder.
230,cuhk03/image=01_set=1_id=0230.png,rab,Picture of a man walking while he checks on his phone. He should be around 20 and he is wearing a blue or black shirt with broad white checks on it. He is wearing grey or black colour pants with a pair of red or black shoes. He is carrying a green colour backpack.
229,cuhk03/image=01_set=1_id=0229.png,rab,"A man in his mid twenties, wearing a light and dark blue tee with a pair of red coloured shorts and pair of red coloured shoes, an adidas. He is wearing eye glasses and his hair is dark and short. He is carrying his mobile phone in his right hand."
228,cuhk03/image=01_set=1_id=0228.png,rab,"A tall woman in black, she is wearing black full sleeve jacket with a pair of black leggings and black short skirt. She has long black hair. She is wearing black shoes with pink laces on it. She is carrying a black or brown colour bag on her right shoulder."
227,cuhk03/image=01_set=1_id=0227.png,rab,A man in his green full sleeve shirt and a pair of blue jeans. He has short dark hair. He is wearing light colour slippers. He is carrying something orange coloured in his right hand.
226,cuhk03/image=01_set=1_id=0226.png,rab,"A girl with spectacles, walking with a blue lid tumbler in her right hand. She is wearing a blue colour jacket with a white colour top inside. And black pants. She wears a pair of red shoes. Her hair is short and dark."
225,cuhk03/image=01_set=1_id=0225.png,rab,"A guy walking and he is not facing the camera. He is wearing a white tshirt with black colour jeans. He wears a pair of red or maroon Nike shoes. He carries a bag on his right shoulder and another bag in his left hand. Both the bags are black in colour. And his hair is also black, and short."
224,cuhk03/image=01_set=1_id=0224.png,rab,"A girl, probably overweight, with long hair and the hair is black. She is wearing a dark colour coat and a pair of black colour leggings. She wears white colour shoes. She is carrying something like a food pack in her right hand."
223,cuhk03/image=01_set=1_id=0223.png,rab,"A teenage girl probably in her late teens, wearing a ponytail in her brown hair. She wears a red tee with dark colour pants. She wears a pair of black shoes. She is carrying a black and red backpack."
222,cuhk03/image=01_set=1_id=0222.png,rab,Profile of a woman wearing white top and a pair of black jeans. She has short hair and it is dark. She is carrying a white and black shopping bag on her right shoulder.
221,cuhk03/image=01_set=1_id=0221.png,rab,She is a woman with long dark hair. She wears a blue top with a pair of blue jeans. Her shoes are white or blue in colour. She carries a shoulder bag on her right shoulder.
220,cuhk03/image=01_set=1_id=0220.png,rab,"A walking man, with dark hair colour and the hair is short. He is wearing black colour shirt with brown colour pants. His shoes are green or grey in colour."
219,cuhk03/image=01_set=1_id=0219.png,rab,A guy walking fast in his beige slippers. He appears to be in his early twenties. He has dark short hair. He is wearing a black tee with a pair of grey shorts. He is carrying a black backpack.
218,cuhk03/image=01_set=1_id=0218.png,rab,"A tall, fat man, probably in his mid twenties, wearing a purple or violet colour tshirt with a pair of dark coloured shorts. He is wearing white shoes with green laces on it. He is carrying a backpack of black and red colour."
217,cuhk03/image=01_set=1_id=0217.png,rab,"The picture appears to be of a girl probably in her teenage, with long brown hair. She is wearing a white top with a grey colour coat on it, with a pair of black colour stockings. She wears black colour shoes. She carries a shoulder bag on her left shoulder."
216,cuhk03/image=01_set=1_id=0216.png,rab,A slim girl with dark brown hair. She is wearing a light colour top with a pair of dark colour pants or leggings. She carries a bag on her left shoulder. She wears grey or white colour shoes.
215,cuhk03/image=01_set=1_id=0215.png,rab,"The Profile of a tall woman with long dark hair, wearing specs, with a black colour top and a pair of grey colour leggings. She wears white colour shoes. She carries a black colour bag on her left shoulder."
214,cuhk03/image=01_set=1_id=0214.png,rab,A woman in her mid twenties with long brown hair. She is wearing sunglasses. She wears a grey colour long top with a pair of light colour tight pants. She wears black colour shoes. She is carrying a violet colour backpack.
213,cuhk03/image=01_set=1_id=0213.png,rab,Picture of a girl with dark hair and a ponytail on it. She wears a black colour tshirt with a pair of grey colour jeans. She wears black colour shoes. She is carrying a beige colour shopping bag on her right shoulder which has a brown colour print on it.
212,cuhk03/image=01_set=1_id=0212.png,rab,"A girl with long dark hair, probably an Asian wearing a dark colour polo tshirt with a white and red colour short skirt. She wears a pair of black boots. She carries a small basket in her left arm with a book inside it."
211,cuhk03/image=01_set=1_id=0211.png,rab,"A tall man wearing black polo tshirt with a pair of black colour pants and black colour shoes, probably a canvas. he is carrying a black colour bag on his left shoulder and is wearing a black colour watch in his right wrist. His hair is black."
210,cuhk03/image=01_set=1_id=0210.png,rab,Looks like a girl wearing bright red hoodie jacket with a pair of grey or some dark colour pants. She has dark hair and it is tiny. She has a grey or white backpack on her back and she is wearing black shoes.
209,cuhk03/image=01_set=1_id=0209.png,rab,A short man talking on the phone while he walks. He is wearing a blue colour shirt with full sleeves rolled up to his elbow with a pair of black colour pants and black colour shoes. He is carrying a bag on his left shoulder which is grey or black in colour. His hair is dark and short.
208,cuhk03/image=01_set=1_id=0208.png,rab,"Fat guy with short hair, he wears a black colour tshirt with a pair of grey or black trousers. He wears a pair of white shoes. He has a fair skin tone. He carries a grey or green colour bag on his back. He is facing the camera and smiling."
207,cuhk03/image=01_set=1_id=0207.png,rab,"A slim and tall woman, with short dark hair, wearing a long grey coat. She is holding a black colour bag in her right hand which has white colour dots in it. She is wearing black and beige high heel wedges."
206,cuhk03/image=01_set=1_id=0206.png,rab,A teenage age with long dark hair. She wears a white top with a pair of dark coloured capri pants. She wears red coloured shoes. She appears to be carrying a bag on her back.
205,cuhk03/image=01_set=1_id=0205.png,rab,"A slim girl with long brown hair, wearing a bracelet in her right wrist. She is wearing a white colour top with a pair of blue colour skinny jeans. She appears to be wearing dark colour shoes."
204,cuhk03/image=01_set=1_id=0204.png,rab,"A boy in his mid teens, with short hair, holding a bag in his left, which is probably a laptop bag. He wears a grey jacket with hoodie and a pair of black jeans. He is wearing dark colour shoes. His hair is short."
203,cuhk03/image=01_set=1_id=0203.png,rab,"A guy wearing brown shaded sunglasses, with dark short hair. He is wearing a black jacket with a pair of grey shorts. He wears brown or red sandals. He carries a backpack that is black and white in colour. He is facing the camera."
202,cuhk03/image=01_set=1_id=0202.png,rab,"Tall man walking and checking his cellular phone, he is wearing a dark blue tshirt with a pair of grey colour trousers. He wears red colour shoes. He carries a cross body bag on his left shoulder. His hair is dark and short and he is wearing eye glasses."
201,cuhk03/image=01_set=1_id=0201.png,rab,A fat woman wearing a green sweatshirt or tshirt with a pair of black leggings and red coloured bright shoes. She carries a small pink backpack and has short and brown hair.
200,cuhk03/image=01_set=1_id=0200.png,rab,A college going girl who has short dark hair. She is wearing a black jacket with a pair of black pants. She wears white and black shoes. She carries a grey or black backpack probably filled with books and notebooks.
199,cuhk03/image=01_set=1_id=0199.png,rab,A man wearing black and white full sleeve shirt with checks on it. He wears a pair of black trousers with brown shoes. He is wearing a watch on his left wrist. He carries a cross body bag which is brown in colour. His hair is black. He wears eye glasses.
198,cuhk03/image=01_set=1_id=0198.png,rab,A boy in his late teens with spectacles on. His hair is short and black. He wears a grey tshirt with a pair of grey pants. He carries a black bag on his back and is holding a roll of papers in his right hand. He wears black shoes.
197,cuhk03/image=01_set=1_id=0197.png,rab,"A woman wearing a denim coat with a mini skirt, carrying a black and red bag in her right arm. She wears red or maroon coloured high heel wedges. Her hair is dark with a long ponytail."
196,cuhk03/image=01_set=1_id=0196.png,rab,"This is a picture of a girl carrying a bag in her right hand, probably a food bag or something similar. She wears a pink jacket with a pair of black jeans and a pair of red or pink shoes. She carries her handbag on her left shoulder, which has white and black horizontal lines on it. Her hair is brown and long. She touches her nose as she walks by."
195,cuhk03/image=01_set=1_id=0195.png,rab,"A pretty, slim, tall girl walking as she checks on her mobile phone. She is wearing a grey tshirt with a black jacket on it and a pair of white mini shorts. She carries a sling bag on her right shoulder. Her hair is very dark and long."
194,cuhk03/image=01_set=1_id=0194.png,rab,"A tall boy, appears very thin and is wearing a black full sleeve shirt and a pair of light colour trousers. He has dark hair and the hair is short. He carries a black backpack and is wearing black shoes."
193,cuhk03/image=01_set=1_id=0193.png,rab,"A short girl with short hair, wearing white tee and a pair of blue jeans. She carries a grey backpack on her back and a grey jacket on her right hand. She appears to be wearing light colour shoes and she is not facing the camera."
192,cuhk03/image=01_set=1_id=0192.png,rab,"A guy with his eye glasses on, with short, dark coloured hair. He wears a white and grey shirt with checks on it and a pair of black pants. He wears white and black shoes and a black or silver watch on his left wrist. He carries a large black backpack."
191,cuhk03/image=01_set=1_id=0191.png,rab,"Appears to be a girl, who is slim and tall, with dark short hair, reading a magazine while she walks. She wears a grey jacket and a pair of dark grey trousers. She wears black slippers."
190,cuhk03/image=01_set=1_id=0190.png,rab,"A man in his mid twenties, wearing a white jacket with full sleeves and a pair of dark pants. He carries a black coloured bag on his back and is wearing black shoes. He has dark hair and he is smiling."
189,cuhk03/image=01_set=1_id=0189.png,rab,"A man in his early twenties, wearing a blue and white shirt with checks on it. He wears a pair of dark coloured pants with white shoes. He carries a black backpack and is wearing a bracelet or watch on his left wrist."
188,cuhk03/image=01_set=1_id=0188.png,rab,"A fit looking man with pink colour tshirt on, and a pair of beige colour trousers. He wears black coloured shoes. He carries a cross body bag which is also beige in colour. He has short hair and he looks like an Asian."
187,cuhk03/image=01_set=1_id=0187.png,rab,"A boy in his early teens wearing blue tshirt with beige colour full pants. he holds something in his right hand, possibly a writing pad or a book and a backpack on his back which is white or green in colour. He smiles as he walks. And he wears red colour shoes."
186,cuhk03/image=01_set=1_id=0186.png,rab,"A tall boy who appears to be very thin, wears a white full sleeve shirt with black pants and a pair of black shoes. He carries a black colour bag in his right hand which looks like a laptop bag. And he carries a black bag on his back."
185,cuhk03/image=01_set=1_id=0185.png,rab,A slim and beautiful woman in a full sleeve black top with a pair of black micro shorts. She wears beige colour shoes. She adjusts her dark long hair while walking.
184,cuhk03/image=01_set=1_id=0184.png,rab,The man with brownish golden hair which is short. He appears medium built with blue tshirt and a pair of grey or black shorts. He wears sunglasses and a pair of black shoes. He carries a black backpack.
183,cuhk03/image=01_set=1_id=0183.png,rab,"Very thin, tall man, with spectacles on his face. He wears a blue and black tshirt with a pair of grey cargo like pants. He wears white or grey shoes and is carrying a red backpack on his back."
182,cuhk03/image=01_set=1_id=0182.png,rab,"An average build woman wearing white top with a pair of blue jeans. She has long and black hair, she wears a pair of beige colour shoes. She holds something in her right hand, which could probably be her jacket."
181,cuhk03/image=01_set=1_id=0181.png,rab,"A boy in his early teens, wearing a white tshirt with black colour pants. He wears a pair of black colour shoes as well. He carries a black backpack. His hair is black too and it is short."
180,cuhk03/image=01_set=1_id=0180.png,rab,"A woman, who is neither tall nor short, walking with her pair of black shoes. She is wearing a blue jacket with white horizontal stripes on it. she wears a pair of blue or grey jeans. She carries a black backpack and is wearing a bracelet or watch in her right wrist."
179,cuhk03/image=01_set=1_id=0179.png,rab,"A tall medium build woman with long dark hair, wearing a long white coat and a pair of black pants. She is carrying a hand bag on her left shoulder and is carrying a green colour water bottle or soft drink in her left arm."
178,cuhk03/image=01_set=1_id=0178.png,rab,"A man with his raincoat or rain jacket on. His jacket is black in colour. He wears a pair of black pants too. He wears red shoes and carries a backpack on his back, which is black in colour. He has black hair and it is short."
177,cuhk03/image=01_set=1_id=0177.png,rab,"A woman walking fast in her white shoes, wearing a pair of black leggings, a short skirt and a green colour jacket with hoodie. She carries a red colour backpack on her back and she has dark long hair."
176,cuhk03/image=01_set=1_id=0176.png,rab,"This picture looks like a college student, a girl holding some books in her left arm. She has long hair and it is black. She wears a purple or violet coloured full sleeve tshirt with a pair of blue jeans. She carries a backpack."
175,cuhk03/image=01_set=1_id=0175.png,rab,"An old man in his late fifties, with half of his head bald, and half of his head covered with some grey and black hair. He is wearing a white or off-white shirt with full sleeves. He wears dark colour pants and is carrying a black backpack. His hands are folded and he is facing the camera."
174,cuhk03/image=01_set=1_id=0174.png,rab,"A man dressed in full black, wearing a black jacket with a pair of black pants, carrying a black backpack on his back. He has short hair and it is black too."
173,cuhk03/image=01_set=1_id=0173.png,rab,"This man appears to be in his late twenties, carrying a red and black bag on his back. He wears a blue tshirt with a pair of grey pants. His hair is dark and short."
172,cuhk03/image=01_set=1_id=0172.png,rab,"A slim and tall girl, probably in her early twenties, with dark her and a ponytail. She wears a white colour full sleeve shirt with a pair of blue jeans. She has her mobile phone in her right hand. She is carrying a backpack black in colour and is wearing orange or pink colour sandals."
171,cuhk03/image=01_set=1_id=0171.png,rab,This looks like a boy wearing eye glasses and he has short hair which is dark. He is wearing a dark colour jacket with a pair of light colour pants. He carries a black backpack and is wearing red shoes.
170,cuhk03/image=01_set=1_id=0170.png,rab,"An neatly dressed woman with long dark hair, wearing a watch in her left wrist. She wears a grey or light purple coloured polo tee with a pair of blue jeans. She is carrying a large brown leather hand bag on her left shoulder."
169,cuhk03/image=01_set=1_id=0169.png,rab,A dark skinned Asian wearing spectacles on his face and a silver colour watch in his left wrist. He wears a dark colour shirt with a pair of dark colour pants. He is carrying a black colour backpack. His hair is dark and short.
168,cuhk03/image=01_set=1_id=0168.png,rab,"A slim girl with burgundy coloured long hair, wearing a white full sleeve tee and a green or blue colour jerkin on it. She wears a pair of dark colour pants and red or brown shoes. She is carrying a pink colour hand bag on her left shoulder and is holding something like a book or a laptop in her right arm."
167,cuhk03/image=01_set=1_id=0167.png,rab,"A girl in her late teens, with long dark hair, walking as she checks her mobile phone. She is wearing a white tshirt with a pair of grey track pants. She wears a pair of white shoes with blue laces."
166,cuhk03/image=01_set=1_id=0166.png,rab,"A person with dark short hair, walking fast with something like a jacket in the right hand. The person wears a white tshirt with a pair of black pants. This person is wearing black shoes and is carrying a backpack on the back."
165,cuhk03/image=01_set=1_id=0165.png,rab,A man walking without showing any part of his to the camera. He has dark short hair. He wears a dark colour shirt with a pair of blue jeans. He carries a black backpack and wears a pair of black shoes.
164,cuhk03/image=01_set=1_id=0164.png,rab,"Girl carrying an orange or red colour hand bag, probably a cartoon themed handbag on her right shoulder. She has dark hair and it is long. She wears a grey colour top with a hoodie and a pair of black jeans. She wears black shoes. She carries something in her left hand, looks like a jacket."
163,cuhk03/image=01_set=1_id=0163.png,rab,"Looks like a college going girl walking with a book or notebook in her right hand. She wears a black colour tshirt with a pair of grey colour pants. She has long dark hair. She carries a brown hand bag on her left shoulder, which has stripes on it from left to right. She wears a pair of black shoes."
162,cuhk03/image=01_set=1_id=0162.png,rab,"A girl, tall and slim, wearing a long blue skirt with prints on it with a grey or blue coat. She has short brown hair and she carries a sling bag on her right shoulder. She has something in her hands, probably a mobile phone."
161,cuhk03/image=01_set=1_id=0161.png,rab,"An Asian girl with lovely long brown hair, carrying a brown leather handbag on her right shoulder. She wears a black shirt with a pair of black pants. She has a bag or something with wheels on it and she slides it with her left hand."
160,cuhk03/image=01_set=1_id=0160.png,rab,Young man walking with his hands inside the pockets of his grey colour shorts. He wears a black colour tshirt. He has dark short hair and is wearing spectacles. He wears grey or white colour shoes.
159,cuhk03/image=01_set=1_id=0159.png,rab,"Profile of a man, who is tall and slim, and is smiling while walking with his friend. He wears a grey or olive colour shirt with checks on it and it has a hoodie. He wears black colour pants and black colour shoes. He has a black and white handbag in his right hand."
158,cuhk03/image=01_set=1_id=0158.png,rab,"Appears like a woman in her formal wear, with black colour shirt and a pair of white or off-white colour pants. She has dark hair which is short. She is carrying a black colour hand bag in her right hand. She wears red colour shoes."
