index,image,annotator,description
538,cuhk03/image=01_set=1_id=0538.png,A11,"A profile of a thin young man, probably a student and probably Asian. He wears a pair of glasses and attired with white full sleeves shirt with no collar. His trousers are most probably brown in color. His black sneakers gives him a athelete look. He is carrying a back pack with a water bottle in it."
537,cuhk03/image=01_set=1_id=0537.png,A11,A girl with her hair tied up is wearing a purple color top and black color leggings. She has a sling bag on her left and she is looking somewhere on her right side while walking. She wears a pair of white canvas shoes.
536,cuhk03/image=01_set=1_id=0536.png,A11,A middle aged man with short black hair is wearing a pair of glasses on his face. He wears a black jacket and probably holding a brown color office bag or a laptop bag in his right hand. He probably has the other hand in his pockets. He is also wearing a pair of black leather shoes.
535,cuhk03/image=01_set=1_id=0535.png,A11,"A profile of a middle aged woman, probably quiet natured and probably Asian. She might be wearing a pair of glasses. She is robed with a white and pink top and a black color pant. Her multi colored back pack adorn her back. She seem to be in no hurry to reach the destination."
534,cuhk03/image=01_set=1_id=0534.png,A11,"A slim girl, probably hair braided, and probably Asian. She wears a gray color top and blue color jeans. Her white and gray shoes seem to be perfectly fit and rich in color. She has a blue color back pack trailing her back and she is walking casually holding it."
533,cuhk03/image=01_set=1_id=0533.png,A11,"A thin boy with short black hair, wearing spectacles. He is wearing a black color jacket and black shorts. He has a back pack, with a bottle in it. He also wears a pair of white sneakers on his legs."
532,cuhk03/image=01_set=1_id=0532.png,A11,"A thin boy with short hair spiked up, is cloaked with white t-shirt and blue jeans. He is wearing a back pack on his back with a bottle on the side pouch that seem to protrude out and a pair of black and white sneakers on his legs. He is walking with his face away from camera."
531,cuhk03/image=01_set=1_id=0531.png,A11,A boy with short hair is wearing a pair of glasses on his face. He wears a grey color t-shirt and a grey color shorts. He is also wearing a back pack and a pair of black sneakers. He is probably holding a laptop or a book in his left hand and is walking with his head held high.
530,cuhk03/image=01_set=1_id=0530.png,A11,"A slim girl with black color hair tied into a pony tail, is gawking into her mobile. She is donned with a stylish blue hooded jacket and light gray jeans. She is wearing a pair of glasses. She has pulled her back pack over to the front and she is resting her hands on the pack. She wears a pair of white sneakers."
529,cuhk03/image=01_set=1_id=0529.png,A11,A boy with short hair is covered with a white t-shirt and a sports jacket that is white in color and a knee length shorts. He has a back pack loaded with items which seem to be heavy. He wears orange color sneakers and seem to be in a cheerful mood.
528,cuhk03/image=01_set=1_id=0528.png,A11,A slim boy with spiky hair is wearing glasses. He is covered with green color full sleeves t-shirt and is wearing gray trousers. He has his gray back pack on his front and carrying a mobile phone on his right hand.
527,cuhk03/image=01_set=1_id=0527.png,A11,"A profile of a middle aged man, wearing a plain white full hand shirt, black color formal trousers and a pair of black leather shoes. He has a back pack on his right and might be holding a laptop bag in his right hand. He is probably holding a mobile phone or keys in his left hand."
526,cuhk03/image=01_set=1_id=0526.png,A11,"A Woman with long black hair facing away from the camera, wearing a black jacket and black color flip-flops. She is carrying a big black color leather hand bag and probably holding some papers in her right hand."
525,cuhk03/image=01_set=1_id=0525.png,A11,A fragile looking girl with medium length hair and long legs is seen walking casually. She is wearing gray color full sleeved jacket and a black color short skirt. She has a black color back pack and black socks with white sneakers.
524,cuhk03/image=01_set=1_id=0524.png,A11,"A slim boy with short hair is walking fast, wearing a white t-shirt with a red color half sleeves shirt over it. He is wearing a black color shorts and a trendy black and yellow sneakers. He is carrying a black color back pack on his back."
523,cuhk03/image=01_set=1_id=0523.png,A11,The person in the image is a man with short hair and eye-glasses. He is dressed in a gray color shirt and gray color jeans. He might be holding a mobile phone in his right hand. He has a sling bag on his right and also a pair of white sneakers.
522,cuhk03/image=01_set=1_id=0522.png,A11,"The person in the image is probably a woman with short hair, facing away from the camera cloaked in a white t-shirt that has black horizontal stripes and a black jeans. She is holding a mobile or a paper in her right hand and wears a black color hand bag on her right. She is wearing a pair of black and white sneakers."
521,cuhk03/image=01_set=1_id=0521.png,A11,"A slim man in his middle ages, wearing a pair of glasses on his face is clothed with a brown color jacket and gray color trousers. He is carrying a black color back pack. He might be wearing a pair of red and white color canvas shoes."
520,cuhk03/image=01_set=1_id=0520.png,A11,"A slim boy with a pair of glasses on his face, wearing a white and gray color jacket and black trousers. He has a beige color back pack on his back. He is walking fast, wearing a pair of black canvas shoes."
519,cuhk03/image=01_set=1_id=0519.png,A11,A slim boy with a pair of glasses is wearing a black t-shirt and gray shorts. He is seen adjusting his glasses with his left hand. He has a black color sling bag on his back. He wears a pair of black canvas shoes without socks and seem to be walking fast.
518,cuhk03/image=01_set=1_id=0518.png,A11,"A slim boy with short black hair, leaning forward is wearing a white t-shirt and beige trousers. He is carrying a back pack on his right. He is holding a shopping bag in his right hand. He wears a pair of white sneakers."
517,cuhk03/image=01_set=1_id=0517.png,A11,A man medium build with short black hair is wearing a blue and white color shirt and gray colored trousers. He has a black color back pack on his back. He probably has put his right hand in his right trouser pocket.
516,cuhk03/image=01_set=1_id=0516.png,A11,"A young woman of medium build profile has a short sweet hair, wearing a black overcoat jacket with a blue top inside and a black jeans. She is probably wearing a pair of brown shoes without socks. She has a black back pack on her back."
515,cuhk03/image=01_set=1_id=0515.png,A11,"A slim girl, with her black hair tied high up, wearing a red and white jacket and black shorts. She is also wearing a black socks and a pair of brown color canvas shoes. She is carrying a hand bag on her left and is probably holding a laptop in her right hand."
2112,cuhk03/image=06_set=1_id=0753.png,B11,"The fat woman is dressed in a long top that has some abstract figures printed on it. Over the top, she can be seen wearing a mint shaded jacket and below loose black pants. To complete her look, she can be seen wearing sandals. The hair of this woman are black, soft and silky and are left open that reach to the shoulders. She is seen holding a green coloured packet in her right hand."
514,cuhk03/image=01_set=1_id=0514.png,A11,A slim man with short hair is wearing a white shirt and a brown color full sleeves top and black color pants. He has a pair of sneakers. He is probably wearing a laptop bag on his right shoulder.
513,cuhk03/image=01_set=1_id=0513.png,A11,"A profile of a girl with shoulder length black, straight hair, wearing a black sleeveless tee, possibly with a white shirt over it. She is decked with a trendy gray shorts and sneakers. She is seen carrying some papers in her right hand."
512,cuhk03/image=01_set=1_id=0512.png,A11,"A man in his middle ages, probably wearing a pair of glasses on his face. He is wearing green t-shirt and black shorts. He has a sling bag on his left and a pair of gray color closed toe sandals."
511,cuhk03/image=01_set=1_id=0511.png,A11,"A middle aged man, walking in a hurry. He is wearing a pair of glasses on his face, a blue long sleeve formal shirt and black formal trousers. He is holding a yellow color large envelope in his right hand. He wears a pair of black shoes."
510,cuhk03/image=01_set=1_id=0510.png,A11,A slim girl with long black hair is wearing possibly a blue color shirt and light blue shorts. She is holding a mobile phone in her left hand. She has a big black hand bag on her right and also black color flip-flops.
509,cuhk03/image=01_set=1_id=0509.png,A11,"A man who looks thin is wearing a pair of glasses on his face, facing the camera. He wears a white t-shirt with a gray color jacket on it and a gray color jeans too. He is holding a laptop bag in his right hand, a back pack with possibly a bottle in it on his back. He has a pair of beige color canvas shoes."
508,cuhk03/image=01_set=1_id=0508.png,A11,"A man who might be in his middle ages is wearing a pair of glasses on his face, a blue color shirt and black color pants. He has a black color back pack on his back and a pair of black canvas shoes."
507,cuhk03/image=01_set=1_id=0507.png,A11,"A medium built woman with short hair, wearing a white and possibly blue color horizontal striped t-shirt with a black color jacket and white shorts. She wears a pair of black and white ankle sneaker. She is probably holding a red color hand bag in her right hand."
506,cuhk03/image=01_set=1_id=0506.png,A11,"A slim girl with long black hair, dressed in a blue top, grey jacket and white shorts. She is fitted in a pair of pink color converse shoes. She is holding a white color hand bag in her left hand and probably holding a small book or phone in her hands."
2111,cuhk03/image=06_set=1_id=0752.png,B11,"The bob cut lady is holding a purse right under her right arm. The woman flaunting the bob cut hairstyle is spotted wearing a black jacket with black jeans. Rest, other details cannot be ascertained because she is facing in the opposite direction of the camera. She might be exiting the premise."
505,cuhk03/image=01_set=1_id=0505.png,A11,The person in this image looks like a woman with short black hair and is wearing a black t-shirt and black jeans. She might be holding a purse or a mobile phone in her left hand. She is carrying a black back pack. She is styling a black strap watch on her left hand. She is wearing a pair of white sneakers with bold black stripes.
2110,cuhk03/image=06_set=1_id=0751.png,B11,"As can be attributed to the image above, the girl is walking in a company dressed in completely black attire. Her hairs, however, are not purely black in colour and are giving a tinge of red, though they are long. She is wearing a black jacket on black jeans and sneakers."
2109,cuhk03/image=06_set=1_id=0750.png,B11,"A fairly medium-profile young man can be seen walking away from the camera in the current image. He is wearing probably a red or orange and black shaded backpack over his black or grey jacket. He has chosen to wear the jacket with black jeans or trousers. This boy's hair is short, trimmed and neatly combed. He might be holding something in his both hands, but it is unclear."
2108,cuhk03/image=06_set=1_id=0749.png,B11,"One can see the back of the girl in the image above. There might be a possibility that she would be exiting the building. The girl, as we can see, is wearing a mustard coloured casual tee which has something printed over it in white. Her black, fairly long hairs come over to her shoulders. She can be seen wearing a grey or black coloured jeans."
504,cuhk03/image=01_set=1_id=0504.png,A11,"A woman, probably in her middle age with shoulder length black hair is wearing a white top and a white sweat shirt with polka dots, black jeans and blue sneakers. She is bearing a black back pack and is holding a white bag in her right hand. She wears a pair of glasses."
503,cuhk03/image=01_set=1_id=0503.png,A11,"A woman, probably in her middle age with shoulder length black hair is wearing a white top and a white sweat shirt with polka dots, black jeans and blue sneakers. She is bearing a black back pack and is holding a white bag in her right hand. She wears a pair of glasses."
502,cuhk03/image=01_set=1_id=0502.png,A11,The picture shows the profile of a man wearing a black t-shirt in the center. He is wearing white shorts and a pair of grey sandals. He is facing towards his left and seems to be wearing glasses.
501,cuhk03/image=01_set=1_id=0501.png,A11,A man with short hair is wearing a white t-shirt and possibly a black color shirt over it and light grey color jean. He has plump cheeks. He might be holding a mobile phone in his left hand. He wears a pair of black canvas shoes with white sole.
500,cuhk03/image=01_set=1_id=0500.png,A11,A Profile of an ill built man attired in a white shirt with blue checks and blue jeans with white sneakers. He is carrying a loaded backpack. He is fitted in a white shoe possibly with a black sole.
2107,cuhk03/image=06_set=1_id=0748.png,B11,"The lady in the footage above is walking in a group and talking to a person beside her. She is wearing a long top that has white and black vertical stripes on black jeans and same hue leather boots. Over the top, she can be seen sporting a black jacket or jumper. The girl's hair is not black in colour and gives a tinge of red. They are neatly tied into a ponytail, though. She can be seen carrying a black tote bag on her left shoulder."
499,cuhk03/image=01_set=1_id=0499.png,A11,A tall and ill built boy slouching forward and hastening towards his right. He wears an orange color t-shirt and beige color trousers. He bears a sling bag probably purple in color and is wearing a watch on his left hand. He seems to be holding what looks like book or a notepad on his right hand. He wears a pair of sneakers.
498,cuhk03/image=01_set=1_id=0498.png,A11,"A boy with short black hair, wearing probably a dark blue or black color sweat shirt with a hoodie and black jeans. He is holding possibly a book or laptop. He seems to be fitted in dark grey sandals and is taking small steps while walking."
497,cuhk03/image=01_set=1_id=0497.png,A11,A slim girl with long black hair is wearing a black full sleeve t-shirt and white shorts with possibly a black color watch on her left hand. She is carrying a big sand brown colored bag on her right shoulders. She is fitted in a white sneaker.
496,cuhk03/image=01_set=1_id=0496.png,A11,"A boy wearing a pair of glasses, white t-shirt and light beige color trouser with white canvas shoes. He is carrying a black backpack. He has a military cut hairdo. He seems to be taking small steps while walking."
495,cuhk03/image=01_set=1_id=0495.png,A11,A slim tall boy with mushroom cut hairdo who is possibly wearing a green t-shirt and a black sweatshirt walking towards his left. He might be holding a mobile in his right hand. He is trending a yellow color knee length shorts and a pair of grey colored flip-flops.
494,cuhk03/image=01_set=1_id=0494.png,A11,A slim girl with long black hair is wearing a sky blue color full hand shirt and a black jeans with red sneakers. She is holding a water bottle in her left hand and is carrying a red color back pack.
493,cuhk03/image=01_set=1_id=0493.png,A11,A slim girl with long black hair is wearing a white t-shirt with black horizontal stripes on it and black skirt and legging. She might be holding a laptop and some papers in her right hand. She has a sling bag on her left hand. She wears heels probably brown color.
492,cuhk03/image=01_set=1_id=0492.png,A11,A slim boy with a white t-shirt and black jeans. He might be wearing a pair of glasses on his face. He wears possibly a black chain on his neck and a sky-blue color back pack with black sneakers.
491,cuhk03/image=01_set=1_id=0491.png,A11,A moderately built middle-aged man wearing a pair of glasses is seen holding a bottle in his hand. He is clothed with half hand black color shirt and khaki shorts. His sandals appear to be red in color. He is carrying a huge bag with him.
490,cuhk03/image=01_set=1_id=0490.png,A11,"A slim boy with a pair of glasses probably black framed, attired in a green color shirt with black color checks on it. He might be wearing a watch on his left hand. His black color 3/4th trousers seem to be of denim variety and a pair of sneakers which are possibly of black color."
489,cuhk03/image=01_set=1_id=0489.png,A11,A slim boy with a black T-shirt and fossil grey color pant. He is probably adjusting the glasses on his face with his right hand. He is wearing a pair of white color slip-On's on his legs. He is probably wearing a white or silver color watch on his left hand.
488,cuhk03/image=01_set=1_id=0488.png,A11,The women prominent in the frame is having a medium hair colored burgundy or may be natural. She is carrying probably a book or a file in her right hand. She is wearing a grey color top with black color jeans and is carrying a white color shopping bag with a bear face on it. She probably wears a brown or black color canvas shoes.
487,cuhk03/image=01_set=1_id=0487.png,A11,"A slim boy, with black hair is wearing a black T-Shirt and probably a grey color 3/4th Trouser. He has blue color back pack and black color watch to his left hand. He wears a pair of glasses and a black sneakers."
486,cuhk03/image=01_set=1_id=0486.png,A11,This boy is very thin and tall taking long strides to reach his destination. He looks like a student who is carrying a sling bag at his back. He is wearing a white hoodie jacket and dark black pants. His features appear to be blunt and he is wearing a pair of glasses.
485,cuhk03/image=01_set=1_id=0485.png,A11,A middle-aged woman carrying a bag in her right hand which is black in color. She is wearing a grey long hand shirt and her hair is dark and short. She has a small round face and looks like an Asian. She is also carrying a beige or brown bag at her back.
484,cuhk03/image=01_set=1_id=0484.png,A11,"A profile of a medium build man, probably middle-aged, and probably Asian. He wears a black t-shirt and a grey coat, a pair of light-colored shorts, possibly light-white or grey, and grey shoes. He is holding a book in his right hand and is carrying a bag . He wears a black pair of spectacles."
2106,cuhk03/image=06_set=1_id=0747.png,B11,The fairly heavy profile lady is in her bob-cut hairstyle. She is carrying a purse with thin strap on her right hand and some paper-like thing in her left. She is also wearing a black top which has 3/4 sleeves on her black jeans. The height of this lady is good but her race or ethnicity cannot be ascertained.
483,cuhk03/image=01_set=1_id=0483.png,A11,"A slim and short girl, wearing a pink colored crocks is walking. She has a phone in her right hand. She is carrying a white or grey colored handbag in her shoulders. She has short black hair. She wears a bracelet in her left hand which is probably either dark blue or black. She also wears a grey colored sweatshirt and a blue capri."
482,cuhk03/image=01_set=1_id=0482.png,A11,"A slim and short guy, probably a college student is walking carrying a dark colored bag possibly black or blue on his shoulders. He is wearing a blue hoodie or a sweatshirt. He is wearing white shoes and probably blue jeans. He has short black hair. He also has a black beard."
481,cuhk03/image=01_set=1_id=0481.png,A11,"A medium build man, probably a college student or an employee wearing a dark colored spectacles probably blue or black. He is wearing black shoes and purple shirt carrying a bag on his shoulders. The guy is walking wearing a grey colored formal trouser and is smiling. He is probably an Asian with black hair."
480,cuhk03/image=01_set=1_id=0480.png,A11,"A lean, short boy, probably a teenager wearing a red or orange t-shirt carrying a black or blue bag wearing white shoes. The boy has a pair of glasses and black hair. He is probably having a conversation with his friend wearing a purple shirt and carrying a bag wearing black shoes."
479,cuhk03/image=01_set=1_id=0479.png,A11,"This man is short and medium built. His overcoat is white in color with light grey stripes and long hand. His head is short and round. He has thick short hair that covers half of his forehead. He wears a pair of light-colored trousers, possibly light-yellow or beige, and dark shoes."
478,cuhk03/image=01_set=1_id=0478.png,A11,A short plumb man with a protruding belly. He is probably an Asian from the looks. He might also be wearing a watch on his hands. His t-shirt is black in color and shorts are loose and it is also pitch black. He wears a black or grey shoes and swinging his arms while walking.
477,cuhk03/image=01_set=1_id=0477.png,A11,"A thin tall girl with dark long hair, wearing a loose tops with half sleeve. The top is black in color matching the pants she is wearing. Her face appears to have a flat feature from the side. And she is probably wearing a glass. Her big bag looks modern with black dots scattered all over the white back ground."
476,cuhk03/image=01_set=1_id=0476.png,A11,The girl in the picture is wearing a short shirt which is white in color with some designs on them. Her red bag looks heavy loaded with things probably books or laptop. Her hair looks dark and bouncy. Her body appears well maintained. She is probably wearing a cut shoe.
475,cuhk03/image=01_set=1_id=0475.png,A11,Here is a girl who is fully loaded with bags on both shoulders. She is very keen on looking something on the phone. Her boots doesn't seem to fit the attire she is wearing. She is wearing a pony tail with a chunk of hair falling on her face which she doesn't seem to bother.
474,cuhk03/image=01_set=1_id=0474.png,A11,A tall boy strolling probably having a chat with his acquaintance. He wears a black hoodie type of jacket with contrast yellow shorts. He appears to have a pair of glasses. His face appears to be round with prominent features.
473,cuhk03/image=01_set=1_id=0473.png,A11,A middle aged man with oval shaped head and pointed nose walking in the direction facing away from camera. He is cool and casual. He is wearing t-shirt of white long sleeves. His pants are well cut and fits his legs. He is wearing a shoe that matches his shirt.
472,cuhk03/image=01_set=1_id=0472.png,A11,"A Medium build body of a boy wearing a white t-Shirt carrying a sling type of bag. His face is totally turned other side while the back of his head alone is visible. His hair is kind of long, straight and silky. His trousers are grey in color. His shoes are quite modern."
471,cuhk03/image=01_set=1_id=0471.png,A11,A profile of a medium build boy probably an Asian. He wears a dark purple polo shirt with some designs in the sleeve. He is carrying a bag on his shoulder which is a combination of red and black color. He is wearing a grey pant with a matching shoes. His face is long with sharp nose.
470,cuhk03/image=01_set=1_id=0470.png,A11,"A tall, slim girl wearing a maroon full length t-shirt and probably a grey slim fit jeans. She has long hair with a light brown hair coloring. She is carrying a black hand bag on her right shoulder and is walking towards her right. she is wearing flat cut shoes."
469,cuhk03/image=01_set=1_id=0469.png,A11,"A tall, moderately built man wearing a light blue or white formal shirt and black formal trousers and black leather shoes. His shirt is tucked in and he is wearing a black belt. He has his right hand in the air and is carrying probably a chart in his left hand . He is wearing glasses."
468,cuhk03/image=01_set=1_id=0468.png,A11,"A tall, moderately built man wearing a dark blue and white semi formal shirt and a black slim fit jean. He has dark hair. He has a stability band on his right hand and is carrying a dark brown bag in his left hand. He is wearing glasses. He wears black shoes with white stripes"
467,cuhk03/image=01_set=1_id=0467.png,A11,"A slim, probably an Asian boy with dark hair walking towards his right. He is probably wearing a white t-shirt and a dark grey sweat shirt with a hoodie. He wears black knee length shorts. He is carrying a black backpack which seems to have a water bottle in the right pouch. He wears sandals which is probably black in color."
466,cuhk03/image=01_set=1_id=0466.png,A11,A moderately built girl with dark long hair is wearing a black half sleeve t-shirt and a black jeans. Her t-shirt has white stripes on the side. Her face is covered partially by her hair and she is looking at her phone. She is carrying a UK flag printed hand bag on her left shoulder and is probably carrying a folder or a note book in her left hand.
465,cuhk03/image=01_set=1_id=0465.png,A11,"A slim, tall probably an Asian boy wearing a light grey sweat shirt with a hoodie and a semi formal grey trousers. He has his hands tucked inside his pockets. He is wearing glasses. He is carrying a grey sling bag and a black shoes with heels."
464,cuhk03/image=01_set=1_id=0464.png,A11,"A short, slim girl wearing probably a denim jacket and a slim fit legging hastening towards her right. She has short hair styling a high pony tail with a fringe cut. She is wearing a red sling bag and red shoes. She is wearing glasses and glancing at her phone."
463,cuhk03/image=01_set=1_id=0463.png,A11,"A moderately built probably an Asian girl wearing a black t-shirt with elbow length sleeve and a black slim fit jean. She has short, thick, dark hair. she is carrying a back hand bag with a dark blue patch in the center. She is wearing a black shoe which has three white stripes on it."
